{"all_observations_post_repair_pass":true,"config_identity":{"context_budget":10,"prompt_roster_hash":"27babc78bd63896347459a277af40890d3c4e3de6fb22a339ea9bb347ad09518","reasoning_mode":"r","repair_budget":2,"sampling_hash":"cccccccccccccccccccccccccccccccccccccccccccccccccccccccccccccccc","variants":{"A":{"adapter_enabled":false,"compiler_loop":false,"context_enabled":false},"B":{"adapter_enabled":false,"compiler_loop":true,"context_enabled":true},"C":{"adapter_enabled":true,"compiler_loop":false,"context_enabled":false},"D":{"adapter_enabled":true,"compiler_loop":true,"context_enabled":true}}},"critical_failures":{},"denominator":{"conditional":false,"distinct_task":1,"distinct_task_ids":1,"expected_observations":4,"filtered":0,"gaps":0,"in":4,"observations":4,"out":4,"policy":"all_tasks_unfiltered","tasks":1},"failure_taxonomy":{"A":{},"B":{},"C":{},"D":{}},"family_breakdown":{"A":{"F-1":{"first_shot":{"denominator":1,"rate":1.0,"successes":1,"total":1,"wilson95":{"lower":0.2065493143772375,"upper":1.0}},"post_repair":{"denominator":1,"rate":1.0,"successes":1,"total":1,"wilson95":{"lower":0.2065493143772375,"upper":1.0}}}},"B":{"F-1":{"first_shot":{"denominator":1,"rate":1.0,"successes":1,"total":1,"wilson95":{"lower":0.2065493143772375,"upper":1.0}},"post_repair":{"denominator":1,"rate":1.0,"successes":1,"total":1,"wilson95":{"lower":0.2065493143772375,"upper":1.0}}}},"C":{"F-1":{"first_shot":{"denominator":1,"rate":1.0,"successes":1,"total":1,"wilson95":{"lower":0.2065493143772375,"upper":1.0}},"post_repair":{"denominator":1,"rate":1.0,"successes":1,"total":1,"wilson95":{"lower":0.2065493143772375,"upper":1.0}}}},"D":{"F-1":{"first_shot":{"denominator":1,"rate":1.0,"successes":1,"total":1,"wilson95":{"lower":0.2065493143772375,"upper":1.0}},"post_repair":{"denominator":1,"rate":1.0,"successes":1,"total":1,"wilson95":{"lower":0.2065493143772375,"upper":1.0}}}}},"identity_hashes":{"adapter_hash":{"off":"none","on":"aaaaaaaaaaaaaaaaaaaaaaaaaaaaaaaaaaaaaaaaaaaaaaaaaaaaaaaaaaaaaaaa"},"base_model_hash":"bbbbbbbbbbbbbbbbbbbbbbbbbbbbbbbbbbbbbbbbbbbbbbbbbbbbbbbbbbbbbbbb","benchmark_hash":"eeeeeeeeeeeeeeeeeeeeeeeeeeeeeeeeeeeeeeeeeeeeeeeeeeeeeeeeeeeeeeee","compiler_hash":"git:cccccccccccccccccccccccccccccccccccccccc","dataset_manifest_hash":"dddddddddddddddddddddddddddddddddddddddddddddddddddddddddddddddd","runtime_hash":"ffffffffffffffffffffffffffffffffffffffffffffffffffffffffffffffff","seed":7,"shared_identity_hash":"dd833adf8520219d28f310a19013d19a72ebc005b93a9a3a14e6b236c8506d30"},"observations":[{"config":{"adapter_enabled":false,"compiler_loop":false,"context_budget":10,"context_enabled":false,"prompt_hash":"aaaaaaaaaaaaaaaaaaaaaaaaaaaaaaaaaaaaaaaaaaaaaaaaaaaaaaaaaaaaaaaa","reasoning_mode":"r","repair_budget":2,"sampling_hash":"cccccccccccccccccccccccccccccccccccccccccccccccccccccccccccccccc"},"critical_failures":[],"evidence":{"first_shot_oracles":{"compile":"sha256:ffffffffffffffffffffffffffffffffffffffffffffffffffffffffffffffff","link":"sha256:ffffffffffffffffffffffffffffffffffffffffffffffffffffffffffffffff","parse":"sha256:ffffffffffffffffffffffffffffffffffffffffffffffffffffffffffffffff","semantic":"sha256:ffffffffffffffffffffffffffffffffffffffffffffffffffffffffffffffff","validate":"sha256:ffffffffffffffffffffffffffffffffffffffffffffffffffffffffffffffff"},"output_sha256":"sha256:dddddddddddddddddddddddddddddddddddddddddddddddddddddddddddddddd","post_repair_oracles":{"compile":"sha256:eeeeeeeeeeeeeeeeeeeeeeeeeeeeeeeeeeeeeeeeeeeeeeeeeeeeeeeeeeeeeeee","link":"sha256:eeeeeeeeeeeeeeeeeeeeeeeeeeeeeeeeeeeeeeeeeeeeeeeeeeeeeeeeeeeeeeee","parse":"sha256:eeeeeeeeeeeeeeeeeeeeeeeeeeeeeeeeeeeeeeeeeeeeeeeeeeeeeeeeeeeeeeee","semantic":"sha256:eeeeeeeeeeeeeeeeeeeeeeeeeeeeeeeeeeeeeeeeeeeeeeeeeeeeeeeeeeeeeeee","validate":"sha256:eeeeeeeeeeeeeeeeeeeeeeeeeeeeeeeeeeeeeeeeeeeeeeeeeeeeeeeeeeeeeeee"}},"failure_category":null,"family":"F-1","first_shot_end_to_end":true,"first_shot_outcomes":{"compile":"pass","link":"pass","parse":"pass","semantic":"pass","validate":"pass"},"first_shot_success":true,"identity":{"adapter_hash":"none","base_model_hash":"bbbbbbbbbbbbbbbbbbbbbbbbbbbbbbbbbbbbbbbbbbbbbbbbbbbbbbbbbbbbbbbb","benchmark_hash":"eeeeeeeeeeeeeeeeeeeeeeeeeeeeeeeeeeeeeeeeeeeeeeeeeeeeeeeeeeeeeeee","compiler_hash":"git:cccccccccccccccccccccccccccccccccccccccc","dataset_manifest_hash":"dddddddddddddddddddddddddddddddddddddddddddddddddddddddddddddddd","runtime_hash":"ffffffffffffffffffffffffffffffffffffffffffffffffffffffffffffffff","seed":7},"leakage_group":"synthetic/g1","post_repair_end_to_end":true,"post_repair_outcomes":{"compile":"pass","link":"pass","parse":"pass","semantic":"pass","validate":"pass"},"post_repair_success":true,"repair_cycles":0,"task_id":"synthetic/f1","tool_failure":false,"variant":"A"},{"config":{"adapter_enabled":false,"compiler_loop":true,"context_budget":10,"context_enabled":true,"prompt_hash":"aaaaaaaaaaaaaaaaaaaaaaaaaaaaaaaaaaaaaaaaaaaaaaaaaaaaaaaaaaaaaaaa","reasoning_mode":"r","repair_budget":2,"sampling_hash":"cccccccccccccccccccccccccccccccccccccccccccccccccccccccccccccccc"},"critical_failures":[],"evidence":{"first_shot_oracles":{"compile":"sha256:ffffffffffffffffffffffffffffffffffffffffffffffffffffffffffffffff","link":"sha256:ffffffffffffffffffffffffffffffffffffffffffffffffffffffffffffffff","parse":"sha256:ffffffffffffffffffffffffffffffffffffffffffffffffffffffffffffffff","semantic":"sha256:ffffffffffffffffffffffffffffffffffffffffffffffffffffffffffffffff","validate":"sha256:ffffffffffffffffffffffffffffffffffffffffffffffffffffffffffffffff"},"output_sha256":"sha256:dddddddddddddddddddddddddddddddddddddddddddddddddddddddddddddddd","post_repair_oracles":{"compile":"sha256:eeeeeeeeeeeeeeeeeeeeeeeeeeeeeeeeeeeeeeeeeeeeeeeeeeeeeeeeeeeeeeee","link":"sha256:eeeeeeeeeeeeeeeeeeeeeeeeeeeeeeeeeeeeeeeeeeeeeeeeeeeeeeeeeeeeeeee","parse":"sha256:eeeeeeeeeeeeeeeeeeeeeeeeeeeeeeeeeeeeeeeeeeeeeeeeeeeeeeeeeeeeeeee","semantic":"sha256:eeeeeeeeeeeeeeeeeeeeeeeeeeeeeeeeeeeeeeeeeeeeeeeeeeeeeeeeeeeeeeee","validate":"sha256:eeeeeeeeeeeeeeeeeeeeeeeeeeeeeeeeeeeeeeeeeeeeeeeeeeeeeeeeeeeeeeee"}},"failure_category":null,"family":"F-1","first_shot_end_to_end":true,"first_shot_outcomes":{"compile":"pass","link":"pass","parse":"pass","semantic":"pass","validate":"pass"},"first_shot_success":true,"identity":{"adapter_hash":"none","base_model_hash":"bbbbbbbbbbbbbbbbbbbbbbbbbbbbbbbbbbbbbbbbbbbbbbbbbbbbbbbbbbbbbbbb","benchmark_hash":"eeeeeeeeeeeeeeeeeeeeeeeeeeeeeeeeeeeeeeeeeeeeeeeeeeeeeeeeeeeeeeee","compiler_hash":"git:cccccccccccccccccccccccccccccccccccccccc","dataset_manifest_hash":"dddddddddddddddddddddddddddddddddddddddddddddddddddddddddddddddd","runtime_hash":"ffffffffffffffffffffffffffffffffffffffffffffffffffffffffffffffff","seed":7},"leakage_group":"synthetic/g1","post_repair_end_to_end":true,"post_repair_outcomes":{"compile":"pass","link":"pass","parse":"pass","semantic":"pass","validate":"pass"},"post_repair_success":true,"repair_cycles":0,"task_id":"synthetic/f1","tool_failure":false,"variant":"B"},{"config":{"adapter_enabled":true,"compiler_loop":false,"context_budget":10,"context_enabled":false,"prompt_hash":"aaaaaaaaaaaaaaaaaaaaaaaaaaaaaaaaaaaaaaaaaaaaaaaaaaaaaaaaaaaaaaaa","reasoning_mode":"r","repair_budget":2,"sampling_hash":"cccccccccccccccccccccccccccccccccccccccccccccccccccccccccccccccc"},"critical_failures":[],"evidence":{"first_shot_oracles":{"compile":"sha256:ffffffffffffffffffffffffffffffffffffffffffffffffffffffffffffffff","link":"sha256:ffffffffffffffffffffffffffffffffffffffffffffffffffffffffffffffff","parse":"sha256:ffffffffffffffffffffffffffffffffffffffffffffffffffffffffffffffff","semantic":"sha256:ffffffffffffffffffffffffffffffffffffffffffffffffffffffffffffffff","validate":"sha256:ffffffffffffffffffffffffffffffffffffffffffffffffffffffffffffffff"},"output_sha256":"sha256:dddddddddddddddddddddddddddddddddddddddddddddddddddddddddddddddd","post_repair_oracles":{"compile":"sha256:eeeeeeeeeeeeeeeeeeeeeeeeeeeeeeeeeeeeeeeeeeeeeeeeeeeeeeeeeeeeeeee","link":"sha256:eeeeeeeeeeeeeeeeeeeeeeeeeeeeeeeeeeeeeeeeeeeeeeeeeeeeeeeeeeeeeeee","parse":"sha256:eeeeeeeeeeeeeeeeeeeeeeeeeeeeeeeeeeeeeeeeeeeeeeeeeeeeeeeeeeeeeeee","semantic":"sha256:eeeeeeeeeeeeeeeeeeeeeeeeeeeeeeeeeeeeeeeeeeeeeeeeeeeeeeeeeeeeeeee","validate":"sha256:eeeeeeeeeeeeeeeeeeeeeeeeeeeeeeeeeeeeeeeeeeeeeeeeeeeeeeeeeeeeeeee"}},"failure_category":null,"family":"F-1","first_shot_end_to_end":true,"first_shot_outcomes":{"compile":"pass","link":"pass","parse":"pass","semantic":"pass","validate":"pass"},"first_shot_success":true,"identity":{"adapter_hash":"aaaaaaaaaaaaaaaaaaaaaaaaaaaaaaaaaaaaaaaaaaaaaaaaaaaaaaaaaaaaaaaa","base_model_hash":"bbbbbbbbbbbbbbbbbbbbbbbbbbbbbbbbbbbbbbbbbbbbbbbbbbbbbbbbbbbbbbbb","benchmark_hash":"eeeeeeeeeeeeeeeeeeeeeeeeeeeeeeeeeeeeeeeeeeeeeeeeeeeeeeeeeeeeeeee","compiler_hash":"git:cccccccccccccccccccccccccccccccccccccccc","dataset_manifest_hash":"dddddddddddddddddddddddddddddddddddddddddddddddddddddddddddddddd","runtime_hash":"ffffffffffffffffffffffffffffffffffffffffffffffffffffffffffffffff","seed":7},"leakage_group":"synthetic/g1","post_repair_end_to_end":true,"post_repair_outcomes":{"compile":"pass","link":"pass","parse":"pass","semantic":"pass","validate":"pass"},"post_repair_success":true,"repair_cycles":0,"task_id":"synthetic/f1","tool_failure":false,"variant":"C"},{"config":{"adapter_enabled":true,"compiler_loop":true,"context_budget":10,"context_enabled":true,"prompt_hash":"aaaaaaaaaaaaaaaaaaaaaaaaaaaaaaaaaaaaaaaaaaaaaaaaaaaaaaaaaaaaaaaa","reasoning_mode":"r","repair_budget":2,"sampling_hash":"cccccccccccccccccccccccccccccccccccccccccccccccccccccccccccccccc"},"critical_failures":[],"evidence":{"first_shot_oracles":{"compile":"sha256:ffffffffffffffffffffffffffffffffffffffffffffffffffffffffffffffff","link":"sha256:ffffffffffffffffffffffffffffffffffffffffffffffffffffffffffffffff","parse":"sha256:ffffffffffffffffffffffffffffffffffffffffffffffffffffffffffffffff","semantic":"sha256:ffffffffffffffffffffffffffffffffffffffffffffffffffffffffffffffff","valida